{
  "source_event_ids": [
    "FLAIM-2026-W2"
  ],
  "fact_layer": [
    "Mud Dogs defeated ObiWan Jacoby 130.84–122.91.",
    "D0nkey K0ng defeated Three Dreaded Snake 165.78–95.87.",
    "Slob on my Dobb defeated Dr. Duckhook 194.92–122.97.",
    "Red Leopards defeated The Chili Cheesers 191.90–100.90.",
    "El Niño defeated His Majesty's Blood 131.06–113.52.",
    "Seven Deadly Chins defeated The LLC 135.38–125.88.",
    "29 Week-2 transaction rows were returned by Flaim."
  ],
  "pattern_layer": [
    "Week 2 contains multiple high-margin reversals alongside active waiver/FAAB behavior."
  ],
  "interpretation_layer": [
    "Any claim about embarrassment, confidence, recklessness, intent or emotion requires narrative/commissioner evidence beyond Flaim."
  ],
  "character_consequences": [
    "Candidate: winners/losses alter material position and reputation only after story translation."
  ],
  "world_consequences": [
    "Candidate: verified acquisitions may translate to contested recruitment/resource movement."
  ],
  "story_promises": [],
  "scene_candidates": [
    "Evaluate existing Week-2 memo storylines against these verified facts."
  ],
  "visual_candidates": [
    "Only after narrative consequence and visual-value gates."
  ],
  "canon_status": "PROPOSED_ONLY"
}